{"album":[{"idAlbum":"2110308","idArtist":"111284","idLabel":null,"strAlbum":"Kenny","strArtist":"Kenny Rogers","intYearReleased":"1979","strStyle":"Country","strGenre":"Country","strLabel":null,"strReleaseFormat":"Album","intSales":"0","strAlbumThumb":"https://www.theaudiodb.com/images/media/album/thumb/rptrvp1386264336.jpg","strAlbumThumbBack":null,"strAlbumCDart":"","intScore":null,"strDescriptionEN":"Kenny is the seventh studio album by Kenny Rogers, released in 1979. It includes the singles \"Coward of the County\" and \"You Decorated My Life.\"\n\"Tulsa Turnaround\" is a reworking of an earlier song Rogers recorded with The First Edition.\n\"Goodbye Marie\" was later recorded by Bobby Goldsboro, charting as a single for him in early 1981.\nThe album reached #5 in the US pop charts and #1 in the country charts (where it stayed for a total of 25 weeks). In the UK, it reached the top 10 on the pop charts. In 2007, the album was issued as a two album set on one CD, the other album included on the disc being the self-titled Kenny Rogers from 1976.\nIn the sleevenotes for the 2009 reissue on the Edsel record label, biographer Chris Bolton notes that this album \"does its best to represent every musical personality of Kenny Rogers.\" Stephen Thomas Erlewine states that the album mixes music styles from Country to Disco.\nThis album has sold 22 million copies worldwide."}]}
